,title,authors,isbn,average_rating,ratings_count,text_reviews_count,best_seller
7768,The Jefferson Bible: The Life And Morals Of Jesus Of Nazareth,Thomas Jefferson,1557091846,3.82,1038,100,True
7769,The Jester,James Patterson/Andrew Gross,755300203,3.8,16563,849,True
7770,The Jew Of Malta,Christopher Marlowe/H. Havelock Ellis,486431843,3.6,2963,120,True
7771,The John Adams Reader: Eseential Writings On An American Composer,Thomas May/John   Adams,1574671324,3.5,20,5,
7772,The John Deere Two-Cylinder Tractor Encyclopedia: The Complete Model-By-Model History,Don Macmillan/Wayne G. Broehl Jr.,076032963X,4.75,4,0,
7773,The John Mcphee Reader,John McPhee/William Howarth,374517193,4.42,562,37,True
7774,The Johnstown Flood,David McCullough,844662925,4.11,14739,1199,
7775,The Journal Of Scott Pendleton Collins: A World War 2 Soldier,Walter Dean Myers,439050138,3.96,1132,181,
7776,The Journals Of Ayn Rand,Ayn Rand/Leonard Peikoff/David Harriman,452278872,3.94,317,14,
7777,The Journals Of Sylvia Plath,Sylvia Plath/Ted Hughes/Frances McCullough,385493916,4.17,1163,64,
7778,The Journey,Kathryn Lasky,439405580,4,11354,404,True
7779,The Journey That Saved Curious George: The True Wartime Escape Of Margret And H.A. Rey,Louise Borden/Allan Drummond,618339248,4.11,1136,224,
7780,The Journey To The East,Hermann Hesse/Hilda Rosner,312421680,3.7,8071,360,True
7781,The Joy Luck Club,Amy Tan,143038095,3.92,565524,7255,
7782,The Jungle,Upton Sinclair/Earl Lee/Kathleen DeGrave,1884365302,3.74,110423,4133,True
7783,The Jungle Books,Rudyard Kipling/Alev Lytle Croutier,451529758,4.02,78036,692,True
7784,The Juvenilia Of Jane Austen And Charlotte Brontë,Jane Austen/Charlotte Brontë/Frances Beer,140432671,3.86,217,7,
7785,The Karamazov Brothers,Fyodor Dostoyevsky/Ignat Avsey,192835092,4.32,235,26,True
7786,The Karma Of Brown Folk,Vijay Prashad,816634394,4.1,344,31,
7787,The Keeper'S Companion 2: Prohibition  Firearms  Tomes  & Creatures,Lynn Willis/Brian M. Sammons/Adam Gauntlett/William Dietze/Greg Henrikson/Charles P. Zaglanis/J. Gordon Olmstead-Dean/M.J. Lempert/James Crowder,1568821867,3.71,41,1,
7788,The Keeper'S Companion Vol. 1,Keith Herber/Brian M. Sammons/William Dietze/Chaosium Inc.,1568821441,3.92,65,1,
7789,The Kept Woman,Susan Donovan,312939507,3.81,4037,143,True
7790,The Kestrel,Lloyd Alexander,141310693,3.98,2742,104,True
7791,The Key,Lynsay Sands,084394482X,4.04,2152,89,True
7792,The Key To Midnight,Dean Koontz/Leigh Nichols,425147517,3.95,24594,239,True
7793,The Key To Rebecca,Ken Follett/Arto Häilä,451207793,3.89,19339,615,
7794,The Kid Stays In The Picture,Robert  Evans,571219314,3.92,2209,176,True
7795,The Killer Angels,Michael Shaara/Stephen Hoye,739309056,4.32,92,37,True
7796,The Killer Angels: A Novel Of The Civil War,Michael Shaara,679643249,4.32,425,48,
7797,The Killing Dance,Laurell K. Hamilton,425209067,4.13,59524,946,True
7798,The Killing Of Monday Brown,Sandra West Prowell,553569694,3.45,92,11,
7799,The Kindness Of Strangers,Katrina Kittle,60564784,4.02,11669,1418,
7800,The King In The Window,Adam Gopnik/Omar Rayyan,786838949,3.6,805,108,
7801,The King Of Attolia,Megan Whalen Turner,006083577X,4.37,28480,2309,True
7802,The King Of Elfland'S Daughter,Lord Dunsany/Neil Gaiman,034543191X,3.84,4918,427,
7803,The King Of Torts,John Grisham,385339658,3.68,68098,1705,True
7804,The King'S Buccaneer,Raymond E. Feist,385236255,4.02,131,6,
7805,The Kingdom Of God Is Within You,Leo Tolstoy/Constance Garnett,486451380,4.13,2403,210,
7806,The Kingdom Of Shadow,Richard A. Knaak,743426924,3.93,1181,24,
7807,The Kissing Hand,Audrey Penn/Ruth E. Harper/Nancy M. Leak,1933718005,4.43,57737,1628,
7808,The Kitchen God'S Wife,Amy Tan,143038109,4.01,66503,1661,
7809,The Knight Of Maison-Rouge,Alexandre Dumas/Julie Rose/Lorenzo Carcaterra,812969634,3.89,1172,70,
7810,The Knights / Peace / The Birds / The Assembly Women / Wealth,Aristophanes/Alan H. Sommerstein/David B. Barrett/David Brett,140443320,3.69,42,1,
7811,The Know-It-All: One Man'S Humble Quest To Become The Smartest Person In The World,A.J. Jacobs,743250621,3.76,24243,2326,
7812,The Known World,Edward P. Jones,61159174,3.83,29686,2626,True
7813,The Konrad Saga,David S. Garnett/David Ferring,1841542768,3.57,74,4,True
7814,The Labours Of Hercules,Agatha Christie/Hugh Fraser,1572704578,3.78,11167,297,True
7815,The Labyrinth Of Solitude And Other Writings,Octavio Paz/Lysander Kemp/Yara Milos,080215042X,4.14,5170,154,True
7816,The Ladies' Paradise,Émile Zola/Robin Buss/Brian  Nelson,192836021,3.99,5525,342,True
7817,The Lady Chosen,Stephanie Laurens,60002069,3.97,5686,193,True
7818,The Lady In Question,Victoria Alexander,60517611,3.77,1286,60,True
7819,The Lady In The Lake  The Little Sister  The Long Goodbye  Playback,Raymond Chandler/Tom Hiney,375415025,4.45,241,11,
7820,The Lake Of Souls,Darren Shan,316016659,4.18,18536,350,True
7821,The Land Of Laughs,Jonathan Carroll,312873115,3.9,4337,352,True
7822,The Land Of The Dead,Mary Pope Osborne/Homer/Troy Howell,786809299,3.97,400,32,True
7823,The Landing Of The Pilgrims,James Daugherty,394846974,3.41,611,69,
7824,The Landmark Thucydides: A Comprehensive Guide To The Peloponnesian War,Thucydides/Robert B. Strassler/Richard Crawley/Victor Davis Hanson,684827905,3.9,1751,170,
7825,The Language Instinct: How The Mind Creates Language,Steven Pinker,60958332,4.03,15441,693,
7826,The Languages Of Pao,Jack Vance,743487141,3.8,894,54,
7827,The Languages Of Tolkien'S Middle-Earth,Ruth S. Noel/J.R.R. Tolkien,395291305,3.98,4685,74,
7828,The Last American Man,Elizabeth Gilbert,142002836,3.81,7966,960,True
7829,The Last Assassin,Barry Eisler,399153594,4.27,189,25,True
7830,The Last Boleyn,Karen Harper,307237907,4.05,9097,205,True
7831,The Last Book Of Swords: Shieldbreaker'S Story,Fred Saberhagen,812505778,3.88,1233,11,
7832,The Last Castle,Jack Vance,425084787,3.79,841,43,True
7833,The Last Castle/Nightwings,Jack Vance/Robert Silverberg,812501942,3.7,43,4,True
7834,The Last Christmas Of Ebenezer Scrooge,Marvin Kaye,1592241336,4.13,14,3,
7835,The Last Dance,Ed McBain,671025708,3.69,752,57,True
7836,The Last Dance: Encountering Death And Dying,Lynne Ann DeSpelder/Albert Lee Strickland,72920963,3.77,123,13,
7837,The Last Days,Raymond Queneau/Barbara Wright/Vivian Kogan,1564781402,3.8,189,17,True
7838,The Last Days Of Henry Viii,Robert Hutchinson,60837330,4.14,1523,23,True
7839,The Last Days Of Pompeii,Edward Bulwer-Lytton/John Gregory Betancourt,158715739X,3.6,1156,68,True
7840,The Last Days Of Socrates,Plato/Hugh Tredennick/Harold Tarrant,140449280,4.08,1686,111,True
7841,The Last Eyewitness: The Final Week,Chris Seay/Rob Pepper/Brian D. McLaren,529123452,3.65,23,6,
7842,The Last Full Measure,Jeff Shaara,345434811,4.24,13438,314,True
7843,The Last Hero,Terry Pratchett/Paul Kidby,60507772,4.17,26427,517,True
7844,The Last Hero: A Discworld Fable,Terry Pratchett/Paul Kidby,057506885X,4.17,830,83,True
7845,The Last Hours Of Ancient Sunlight: The Fate Of The World And What We Can Do Before It'S Too Late,Thom Hartmann/Joseph Chilton Pearce/Neale Donald Walsch,1400051576,4.23,1392,136,
7846,The Last Innocent Man,Phillip Margolin,60739681,3.91,1667,57,True
7847,The Last Jew,Noah Gordon/Mirjana Cvekić/Ljiljana Cvekić,312300530,4.1,4360,189,True
7848,The Last Joy,Knut Hamsun/Sverre Lyngstad,1931243190,3.77,129,8,True
7849,The Last Juror,John Grisham,385339682,3.87,72294,1755,True
7850,The Last Kingdom,Bernard Cornwell/Jamie Glover,61126578,4.25,16,1,True
7851,The Last Life,Claire Messud,156011654,3.56,1426,201,True
7852,The Last Lion 2: Winston Spencer Churchill: Alone  1932-40,William Manchester,316545120,4.48,240,27,True
7853,The Last Lion: Winston Spencer Churchill: Visions Of Glory  1874-1932,William Manchester,316545031,4.42,335,38,
7854,The Last Lion: Winston Spencer Churchill: Visions Of Glory 1874-1932,William Manchester,385313489,4.42,9659,467,
7855,The Last Night Of Ballyhoo,Alfred Uhry,1559361409,3.71,259,16,True
7856,The Last Of Her Kind,Sigrid Nunez,312425945,3.72,1459,242,True
7857,The Last Of The Mohicans,James Fenimore Cooper,553213296,3.7,75121,1797,True
7858,The Last Quarry,Max Allan Collins,843955937,3.93,673,68,True
7859,The Last Shogun: The Life Of Tokugawa Yoshinobu,Ryōtarō Shiba/Juliet Winters Carpenter,1568363567,3.76,296,29,True
7860,The Last Shot: City Streets  Basketball Dreams,Darcy Frey,618446710,4.17,5106,155,
7861,The Last Story,Christopher Pike,689854595,3.65,2208,62,True
7862,The Last Temptation,Val McDermid,312936915,4.01,4991,271,True
7863,The Last Temptation Of Christ,Nikos Kazantzakis/Peter A. Bien,068485256X,4.16,8966,454,True
7864,The Last Unicorn,Peter S. Beagle,370006542,4.17,97,17,True
7865,The Last Wife Of Henry Viii,Carolly Erickson,312352182,3.89,10702,366,True
7866,The Late Mattia Pascal,Luigi Pirandello/William Weaver/Charles Simic,1590171152,4.03,6185,108,
7867,The Laughing Corpse,Laurell K. Hamilton,425204669,4.12,67686,1409,True
7868,The Laughing Jesus: Religious Lies And Gnostic Wisdom,Tim Freke/Peter Gandy,140008279X,3.96,346,31,
7869,The Laura Ingalls Wilder Country Cookbook,Laura Ingalls Wilder/William   Anderson,64461963,4.09,234,18,
7870,The Law And The Lady,Wilkie Collins/David Skilton,140436073,3.8,120,15,True
7871,The Laws Of Our Fathers,Scott Turow,446604402,3.75,3655,162,True
7872,The Lay Of The Land,Richard Ford,679454683,3.9,3255,353,True
7873,The Leader In You: How To Win Friends  Influence People And Succeed In A Changing World,Dale Carnegie/Stuart R. Levine/Michael A. Crom,671519980,4.08,3713,103,True
7874,The Leadership Challenge,James M. Kouzes/Barry Z. Posner,787968331,4.05,873,40,True
7875,The Leadership Challenge: Skills For Taking Charge,Warren G. Bennis,088684049X,0,0,0,
7876,The League Of Night And Fog,David Morrell,446691925,4.1,2564,64,True
7877,The Leatherstocking Tales  Vol. 1: The Pioneers / The Last Of The Mohicans / The Prairie,James Fenimore Cooper/Blake Nevius,940450208,3.88,348,24,
7878,The Leatherstocking Tales  Vol. 2: The Pathfinder / The Deerslayer,James Fenimore Cooper/Blake Nevius,940450216,3.98,130,12,
7879,The Legacy Of Luna: The Story Of A Tree  A Woman  And The Struggle To Save The Redwoods,Julia Butterfly Hill,62516590,3.95,1844,220,
7880,The Legacy Of Mark Rothko,Lee Seldes,306807254,3.87,36,5,True
7881,The Legacy Of Sovereign Joy: God'S Triumphant Grace In The Lives Of Augustine  Luther  And Calvin,John Piper,1581348134,4.27,839,65,True
7882,The Legend Of Huma,Richard A. Knaak,078693137X,4.03,17274,113,True
7883,The Legend Of Luke,Brian Jacques,142501093,4,14205,144,True
7884,The Legend Of Spud Murphy,Eoin Colfer/Glenn McCoy,786855010,3.88,92,25,True
7885,The Legend Of The Poinsettia,Tomie dePaola,698115678,4.19,2401,115,True
7886,The Lemon Table,Julian Barnes,1400076501,3.68,2043,167,True
7887,The Letters Of J.R.R. Tolkien,J.R.R. Tolkien/Humphrey Carpenter/Christopher Tolkien,618056998,4.15,4689,171,
7888,The Letters Of John And Abigail Adams,Abigail Adams/Frank Shuffelton,142437115,4.14,275,28,True
7889,The Letters Of Virginia Woolf: Volume Four  1929-1931,Virginia Woolf/Nigel Nicolson/Joanne Trautmann,156508842,4.41,106,2,
7890,The Letters Of Virginia Woolf: Volume Six  1936-1941,Virginia Woolf/Nigel Nicolson/Joanne Trautmann,156508877,4.48,96,2,
7891,The Letters Of Vita Sackville-West And Virginia Woolf,Louise DeSalvo/Mitchell Alexander Leaska/Vita Sackville-West/Virginia Woolf,1573441961,4.27,1133,37,
7892,The Liars' Club,Mary Karr,143035746,3.93,52578,2464,True
7893,The Liberated Bride,A.B. Yehoshua/Hillel Halkin,156030160,3.77,457,44,True
7894,The Liberty Bell,Debra Hess,761417133,3.83,4,0,True
7895,The Library 1  Books 1-3.9,Apollodorus/James George Frazer,674991354,3.93,21,2,
7896,The Library Of Apollodorus: Gods And Heroes Of The Greeks,Apollodorus/Selwyn Reginald Cudjoe/Leonard Baskin,870232061,3.98,11,1,
7897,The Library Of Greek Mythology,Apollodorus/Robin Hard,192839241,3.98,1047,34,
7898,The Life And Death Of My Lord Gilles De Rais,Robert Nye,349102503,3.87,65,8,
7899,The Life And Games Of Mikhail Tal,Mikhail Tal/Iakov Damsky/Kenneth P. Neat,1857442024,4.52,442,24,
7900,The Life And Opinions Of Tristram Shandy  Gentleman,Laurence Sterne/Robert Folkenflik,375761195,3.74,96,11,
7901,The Life And Times Of Scrooge Mcduck,Don Rosa,911903968,4.67,2467,149,
7902,The Life And Times Of Scrooge Mcduck Companion,Don Rosa,1888472405,4.48,959,22,
7903,The Life And Times Of The Thunderbolt Kid: A Memoir,Bill Bryson,767919378,3.94,1329,250,
7904,The Life Of Charlotte Brontë,Elizabeth Gaskell/Angus Easson,192838059,3.91,5549,129,True
7905,The Life Of Dashiell Hammett,Diane Johnson,070112766X,3.73,4,0,True
7906,The Life Of Emily Dickinson,Richard B. Sewall,674530802,4.29,315,20,
7907,The Life Of Graham Greene  Vol. 1: 1904-1939,Norman Sherry,142004200,4.11,170,21,
7908,The Life Of Our Lord: Written For His Children During The Years 1846 To 1849,Charles Dickens,684865378,4.01,1729,364,
7909,The Life Of Sir Arthur Conan Doyle,John Dickson Carr/Daniel Stashower,786712341,4.01,148,6,
7910,The Life You Were Born To Live,Dan Millman,1567313981,4.11,19,1,
7911,The Light Fantastic,Terry Pratchett,61020702,3.97,91479,2031,True
7912,The Lighthouse,P.D. James,307275736,3.81,10651,711,True
7913,The Lighthouse At The End Of The World,Jules Verne,1589630947,3.64,1752,40,
7914,The Lighthouse Land,Adrian McKinty,081095480X,3.6,861,114,True
7915,The Lightning Thief,Rick Riordan,786838655,4.25,1766725,47951,True
7916,The Lilac Bus,Maeve Binchy,99498642,3.62,9649,297,True
7917,The Line Between,Peter S. Beagle,1892391368,4.12,707,97,True
7918,The Lion  The Witch And The Wardrobe,C.S. Lewis/Pauline Baynes,60530839,4.21,381,19,
7919,The Lion'S Game,Nelson DeMille,446679097,4.19,26514,1008,True
7920,The List,Steve Martini,515121495,3.96,12534,141,True
7921,The Listener'S Bible: Niv,Anonymous/Max McLean,1931047170,4.6,28,3,
7922,The Listerdale Mystery And Eleven Other Stories,Agatha Christie/Hugh Fraser,1572704977,3.56,1824,89,True
7923,The Little Baby Snoogle-Fleejer,Jimmy Carter/Amy Carter,812927311,3.17,42,11,
7924,The Little Book Of Coaching: Motivating People To Be Winners,Kenneth H. Blanchard/Don Shula,66621038,3.65,73,12,True
7925,The Little Butterfly,Sherry Shahan,679888098,4.03,17,6,True
7926,The Little Fire Engine,Lois Lenski,375810706,3.56,209,27,True
7927,The Little Friend,Donna Tartt,747573646,3.46,808,112,True
7928,The Little House,Philippa Gregory,6496431,3.68,1910,237,True
7929,The Little House Cookbook: Frontier Foods From Laura Ingalls Wilder'S Classic Stories,Barbara M. Walker/Garth Williams,64460908,4.15,3375,91,
7930,The Little Mouse  The Red Ripe Strawberry And The Big Hungry Bear,Don    Wood,859533301,4.32,65,10,
7931,The Little Princesses,Marion Crawford/Jennie Bond,312312156,4.03,416,65,True
7932,The Little Red Lighthouse And The Great Gray Bridge,Hildegarde Hoyt Swift/Lynd Ward,152045732,4.26,2276,101,
7933,The Littles And The Lost Children,John Lawrence Peterson/Jacqueline Rogers/Roberta Carter Clark,590430262,3.76,302,16,
7934,The Littles And Their Amazing New Friend,John Lawrence Peterson,590876120,3.87,190,16,True
7935,The Lives Of Animals,J.M. Coetzee/Amy Gutmann/Peter Singer/Wendy Doniger/Barbara Smuts/Marjorie Garber,069107089X,3.69,1930,139,True
7936,The Living And The Dead: Robert Mcnamara And Five Lives Of A Lost War,Paul Hendrickson,067978117X,4.01,135,11,
7937,The Living Blood,Tananarive Due,671040847,4.34,1862,124,True
7938,The Locked Room,Paul Auster,940650762,3.89,2998,164,True
7939,The Loftier Way: Tales From The Ancient American Frontier,Blaine M. Yorgason/Brenton G. Yorgason,087747785X,3.78,9,2,True
7940,The Log From The Sea Of Cortez,John Steinbeck/Richard Astro,141186070,3.84,3427,276,
7941,The Lollipop Shoes,Joanne Harris,385609485,3.83,200,27,
7942,The London Blitz Murders,Max Allan Collins,425198057,3.72,209,35,True
7943,The Long Dark Tea-Time Of The Soul,Douglas Adams,671742515,4.06,67803,1401,
7944,The Long Goodbye,Raymond Chandler,394757688,4.22,26389,1619,True
7945,The Long Goodbye: Memories Of My Father,Patti   Davis,452286875,3.82,214,31,
7946,The Long Hard Road Out Of Hell,Marilyn Manson/Neil Strauss,60987464,3.89,22293,1141,True
7947,The Long Road Back: A Survivor'S Guide To Anorexia,Judy Tam Sargent/Sonia Nordenson,1880823195,3.2,30,3,True
7948,The Long Road Home,Danielle Steel,552145025,4,7407,297,True
7949,The Long Shadow,Cynthia Harrod-Eagles,751506435,4.12,376,17,True
7950,The Long Walk,Richard Bachman/Stephen King,451196716,4.11,94303,4453,True
7951,The Long Walk: The True Story Of A Trek To Freedom,Sławomir Rawicz,1592289444,4.21,11841,1766,
7952,The Long Winter,Laura Ingalls Wilder/Garth Williams,60885424,4.14,67427,1048,True
7953,The Long-Lost Map,Pierdomenico Baccalario/Iacopo Bruno/Leah D. Janeczko,043977439X,4,1693,76,True
7954,The Longest Journey,E.M. Forster/Gilbert Adair/Elizabeth Heine,141441488,3.48,1665,125,True
7955,The Looking Glass Wars,Frank Beddor,803731531,3.93,37148,3142,True
7956,The Lorax,Dr. Seuss,679889108,4.35,260054,3532,True
7957,The Lord God Made Them All,James Herriot,312966202,4.42,12580,197,True
7958,The Lord Of The Rings,J.R.R. Tolkien,618517650,4.5,1710,91,True
7959,The Lord Of The Rings / The Hobbit,J.R.R. Tolkien,7144083,4.59,141,5,
7960,The Lord Of The Rings And Philosophy: One Book To Rule Them All,Gregory Bassham/Eric Bronson,812695453,4.28,4913,40,
7961,The Lord Of The Rings Millennium Edition Boxed Set,J.R.R. Tolkien,618037667,4.5,120,5,
7962,The Lord Of The Rings Sketchbook,Alan  Lee/Ian McKellen,618640142,4.27,9853,72,
7963,The Lord Of The Rings- 3 Volumes Set,J.R.R. Tolkien,618574999,4.5,232,9,
7964,The Lord Of The Rings: A Reader'S Companion,Wayne G. Hammond/Christina Scull,618642676,4.35,4380,21,
7965,The Lord Of The Rings: Complete Visual Companion,Jude Fisher,618510826,4.5,359,6,
7966,The Lord Of The Rings: Official Movie Guide,Brian Sibley,618154027,4.39,6356,21,True
7967,The Lord Of The Rings: The Art Of The Fellowship Of The Ring,Gary Russell,618212906,4.59,26153,102,
7968,The Lord Of The Rings: The Making Of The Movie Trilogy,Brian Sibley/Ian McKellen,618260226,4.47,8051,34,
7969,The Lord Of The Rings: The Return Of The King - Visual Companion,Jude Fisher,7116268,4.59,26,3,
7970,The Lord Of The Rings: The Two Towers: Visual Companion,Jude Fisher/Viggo Mortensen,618258027,4.51,4524,23,
7971,The Lord Of The Rings: Weapons And Warfare,Chris   Smith/Christopher  Lee/Richard Taylor,618391002,4.53,19822,46,True
7972,The Lost Blogs: From Jesus To Jim Morrison--The Historically Inaccurate And Totally  Fictitious Cyber Diaries Of Everyone Worth Knowing,Paul       Davidson,446697389,3.61,30,5,
7973,The Lost Boy,Dave Pelzer,1558745157,4.1,52028,2513,True
7974,The Lost Continent,Edgar Rice Burroughs,1600961509,3.68,1235,59,True
7975,The Lost Continent:  Travels In Small-Town America,Bill Bryson,552998087,3.83,729,78,
7976,The Lost Continent: The Story Of Atlantis,Charles John Cutcliffe Wright Hyne/Gary Hoppenstand/Harry Turtledove,803273320,3.78,19,1,True
7977,The Lost Continent: Travels In Small Town America,Bill Bryson,60920084,3.83,45712,2257,
7978,The Lost Lunar Baedeker: Poems Of Mina Loy,Mina Loy/Roger L. Conover,374525072,4.17,1469,63,True
7979,The Lost Painting,Jonathan Harr,375759867,3.74,24619,765,True
7980,The Lost Road And Other Writings,J.R.R. Tolkien/Christopher Tolkien,261102257,3.97,97,10,True
7981,The Lost Tomb,Kent R. Weeks,688172245,4.09,391,26,True
7982,The Lost World,Arthur Conan Doyle/Philip Gooden,142002720,3.92,18,4,True
7983,The Lost Years Of Merlin,T.A. Barron,441010288,3.98,12117,452,True
7984,The Love Of The Last Tycoon,F. Scott Fitzgerald,20199856,3.65,7135,386,True
7985,The Love You Make: An Insider'S Story Of The Beatles,Peter     Brown/Steven Gaines/Anthony DeCurtis,451207351,4.08,2491,110,True
7986,The Lovely Bones,Alice Sebold,330485385,3.81,6485,966,True
7987,The Luck Of The Bodkins,P.G. Wodehouse,1585673366,4.08,1290,88,True
7988,The Lunatic Cafe,Laurell K. Hamilton,425201376,4.12,64036,962,True
7989,The Lure Of The Basilisk,Lawrence Watt-Evans,1587155877,3.71,493,17,True
7990,The Lust Lizard Of Melancholy Cove,Christopher Moore,60735457,3.87,29113,1203,True
7991,The Luzhin Defense,Vladimir Nabokov/Michael Scammell,679727221,3.95,7305,277,True
7992,The Macgregors: Alan & Grant,Nora Roberts,037328523X,4.11,9423,90,True
7993,The Macgregors: Serena & Caine,Nora Roberts,373285132,4.09,11070,150,
7994,The Macmillan Bible Atlas,Yohanan Aharoni/Michael Avi-Yonah,25006053,4.32,14,2,True
7995,The Mad Ship,Robin Hobb,6498868,4.23,38753,893,True
7996,The Madman Of Bergerac,Georges Simenon,141187263,3.77,7,1,True
7997,The Madness Season,C.S. Friedman,886774446,4.05,2459,95,True
7998,The Magic Barrel,Bernard Malamud/Jhumpa Lahiri,374525862,3.99,1958,95,True
7999,The Magic Finger,Roald Dahl/Quentin Blake,141311290,3.68,23558,1092,True
8000,The Magic Journey,John     Nichols,805063390,3.91,449,28,True
8001,The Magic Of Krynn,Margaret Weis/Tracy Hickman/Barbara Siegel/Scott Siegel/Roger E. Moore/Warren B. Smith/Nick O'Donohoe/Richard A. Knaak/Nancy Varian Berberick/Mary L. Kirchoff/Michael   Williams,880384549,3.74,7543,39,True
8002,The Magical Worlds Of Lord Of The Rings: The Amazing Myths  Legends And Facts Behind The Masterpiece,David Colbert,425187713,4.08,2073,50,
8003,The Magicians' Guild,Trudi Canavan,1841493139,3.95,56333,1565,True
8004,The Magus,John Fowles,316296198,4.05,38247,1915,True
8005,The Magus Of Freemasonry: The Mysterious Life Of Elias Ashmole—Scientist  Alchemist  And Founder Of The Royal Society,Tobias Churton,1594771227,4.1,28,5,True
8006,The Maiden,Cynthia Harrod-Eagles,751506451,4.27,330,11,True
8007,The Main,Trevanian,1400098238,3.86,920,32,True
8008,The Main Corpse,Diane Mott Davidson,553574639,3.86,315,22,True
8009,The Major Plays,Anton Chekhov/Ann Dunnigan/Rosamund Bartlett/Robert Brustein,451530373,4.18,102,16,True
8010,The Major Works,John Milton/Jonathan Goldberg/Stephen Orgel,019280409X,4.24,285,12,True
8011,The Making Of A Philosopher: My Journey Through Twentieth-Century Philosophy,Colin McGinn,60957603,3.65,226,31,
8012,The Making Of Disney'S Animal Kingdom Theme Park,Melody Malmberg/Walt Disney Company,786864028,4.32,34,2,
8013,The Making Of Master And Commander: The Far Side Of The World,Tom McGregor,393325539,3.97,96,13,True
8014,The Making Of Pride And Prejudice,Sue Birtwistle/Sue Conklin/Susie Conklin,014025157X,4.45,4244,99,True
8015,The Making Of Star Wars,J.W. Rinzler/Peter  Jackson,345494768,4.53,1198,95,True
8016,The Making Of The Fittest: Dna And The Ultimate Forensic Record Of Evolution,Sean B. Carroll/Jamie W. Carroll/Leanne M. Olds,393061639,4.07,2611,105,
8017,The Makioka Sisters,Jun'ichirō Tanizaki/Edward G. Seidensticker,679761640,4.03,4596,441,True
8018,The Malloreon  Vol. 1: Guardians Of The West / King Of The Murgos / Demon Lord Of Karanda,David Eddings,345483863,4.34,4839,71,
8019,The Malloreon  Vol. 2: Sorceress Of Darshiva / The Seeress Of Kell,David Eddings,345483871,4.36,5457,59,
8020,The Maltese Falcon,Dashiell Hammett,752865331,3.91,69254,2997,True
8021,The Mambo Kings Play Songs Of Love,Oscar Hijuelos,60845309,3.68,132,19,
8022,The Mammoth Book Of Egyptian Whodunnits,Mike Ashley/Elizabeth Peters/Lynda S. Robinson/Lauren Haney,786710659,3.91,161,9,True
8023,The Mammoth Book Of Golden Age Science Fiction: Ten Classic Stories From The Birth Of Modern Science Fiction Writing,Isaac Asimov/Charles G. Waugh,786719052,3.93,128,12,
8024,The Mammoth Book Of New Jules Verne Adventures: Return To The Center Of The Earth And Other Extraordinary Voyages  New Tales By The Heirs Of Jules Verne,Mike Ashley/Eric Brown/Keith Brooke/Johan Heliot/Kevin J. Anderson/Sarah A. Hoyt/Justina Robson/Adam Roberts/Paul Di Filippo/Tim Lebbon/Molly Brown/Tony Ballantyne/Stephen Baxter/Richard A. Lupoff/Sharan Newman/Michael Pagel/Liz Williams/Brian Stableford/James Lovegrove/Ian Watson/Peter Criwther/Laurent Genefirt/F. Gwynplaine MacIntyre/Michael Mallory,786714956,3.63,28,4,
8025,The Mammoth Book Of Storms  Shipwrecks And Sea Disasters,Richard Russell Lawrence,786714689,3.57,11,3,
8026,The Man And The Author: John Milton: Twentieth Century Perspectives,J. Martin Evans,415940478,0,0,0,
8027,The Man From St. Petersburg,Ken Follett,451208706,3.88,16057,663,
8028,The Man In The Black Suit: 4 Dark Tales,Stephen King/Ana Juan/John Cullum/Becky Ann Baker/Íñigo Jáuregui/Peter Gerety/Arliss Howard,074352585X,3.78,1369,101,
8029,The Man Who Changed Everything: The Life Of James Clerk Maxwell,Basil Mahon,470861711,4.13,500,46,
8030,The Man Who Listens To Horses,Monty Roberts/Lucy Grealy/Lawrence Scanlan,034542705X,4.12,9963,206,
8031,The Man Who Loved Jane Austen,Sally Smith O'Rourke,075821037X,3.37,1745,229,
8032,The Man Who Smiled,Henning Mankell/Laurie Thompson,1565849930,3.93,14322,521,True
8033,The Man Who Wasn'T Maigret: A Portrait Of Georges Simenon,Patrick Marnham,156000598,4.08,44,7,
8034,The Man Who Watched Trains Go By,Georges Simenon/Marc Romano/D. Thin/Luc Sante,1590171497,3.85,1392,86,True
8035,The Man With A Load Of Mischief,Martha Grimes,451410815,3.99,14812,461,
8036,The Mandarins,Simone de Beauvoir/Leonard M. Friedman,7203942,4.14,3250,194,True
8037,The Manhattan Hunt Club,John Saul,345490649,3.98,4889,221,
8038,The Manolo Matrix,Julie Kenner,743496140,3.62,651,34,True
8039,The Mantle Of Kendis-Dai,Margaret Weis/Tracy Hickman,345397614,3.57,194,7,True
8040,The Mantle Of The Prophet: Religion And Politics In Iran,Roy Mottahedeh,1851682341,4.08,412,42,True
8041,The Many Worlds Of Magnus Ridolph,Jack Vance,879975318,3.9,282,16,
8042,The Map That Changed The World: William Smith And The Birth Of Modern Geology,Simon Winchester,60931809,3.82,10452,539,True
8043,The Maps Of Tolkien'S Middle-Earth,Brian Sibley/John  Howe/J.R.R. Tolkien,061839110X,4.14,7649,31,
8044,The March,E.L. Doctorow,812976150,3.8,8266,831,True
8045,The Mark Of The Crown,Jude Watson,590519344,3.73,2319,63,True
8046,The Marriage Lesson,Victoria Alexander,380818205,3.9,1484,67,True
